{
  "id": "second-trait-d-essai",
  "name": "Second trait d'essai",
  "source": "original",
  "level": 2,
  "school": "evocation",
  "castingTime": "1 action",
  "range": "36 m",
  "rangeMeters": 36,
  "duration": "instantanee",
  "attackRoll": true,
  "damage": "3d6",
  "damageType": "fire",
  "text": "Fixture : un sort de niveau 2 appris au niveau 3, pour verifier que la table donne les sorts au niveau ou elle les ecrit."
}
