{
  "id": "sacred-flame",
  "name": "Flamme sacree",
  "source": "phb-fr",
  "level": 0,
  "school": "evocation",
  "castingTime": "1 action",
  "range": "18 metres",
  "rangeMeters": 18,
  "savingThrow": "dexterity",
  "saveEffect": "negates",
  "cantripScaling": true,
  "components": {
    "verbal": true,
    "somatic": true,
    "material": false
  },
  "duration": "instantanee",
  "damage": "1d8",
  "damageType": "radiant",
  "text": "Manuel des Joueurs, PDF p. 242 (sacred flame). La cible reussit un jet de sauvegarde de Dexterite ou subit 1d8 degats radiants ; un abri ne l'aide pas. Les degats augmentent d'un d8 aux niveaux 5, 11 et 17."
}
